CODIGO,DISTRITO,DEPARTAMENTO,MUNICIPIO,ESTABLECIMIENTO,DIRECCIÓN,TELEFONO,SUPERVISOR,DIRECTOR,NIVEL,SECTOR,AREA,STATUS,MODALIDAD,JORNADA,PLAN,DEPARTAMENTAL
18-01-0041-46,18-006,IZABAL,PUERTO BARRIOS,ESCUELA NACIÓNAL MIXTA DE CIENCIAS COMERCIALES DOMINGO JUARROS,14 CALLE Y 11 AVENIDA,79480444,CYNTHIA AZUCELLY BARRIENTOS LOPEZ,EDWIN NATALIO MARMOL LOAIZA,DIVERSIFICADO,OFICIAL,URBANA,ABIERTA,MONOLINGÜE,MATUTINA,DIARIO(REGULAR),IZABAL
18-01-0042-46,18-005,IZABAL,PUERTO BARRIOS,ESCUELA PARTICULAR MIXTA JUSTO RUFINO BARRIOS,8A AVENIDA ENTRE 17 Y 18 CALLES,79487032,ELENA ELIZABETH SUCHITE GARNICA DE QUINTANILLA,MARIO RENÉ JUÁREZ SALGUERO,DIVERSIFICADO,PRIVADO,URBANA,ABIERTA,MONOLINGÜE,VESPERTINA,DIARIO(REGULAR),IZABAL
18-01-0043-46,18-005,IZABAL,PUERTO BARRIOS,COLEGIO DE CIENCIAS DE LA COMPUTACIÓN,8A. AVENIDA Y 10A. CALLE,,ELENA ELIZABETH SUCHITE GARNICA DE QUINTANILLA,,DIVERSIFICADO,PRIVADO,URBANA,CERRADA TEMPORALMENTE,MONOLINGÜE,VESPERTINA,DIARIO(REGULAR),IZABAL
18-01-0045-46,18-005,IZABAL,PUERTO BARRIOS,COLEGIO PARTICULAR MIXTO CRISTO REY,10A CALLE ENTRE 8A Y 9A AVENIDAS,79488225,ELENA ELIZABETH SUCHITE GARNICA DE QUINTANILLA,ROSSANA ADALI PARHAM ROMERO,DIVERSIFICADO,PRIVADO,URBANA,ABIERTA,MONOLINGÜE,VESPERTINA,DIARIO(REGULAR),IZABAL
18-01-0073-46,18-005,IZABAL,PUERTO BARRIOS,COLEGIO TECNICO PRIVADO MIXTO LA PATRIA,"FRENTE A LA BOMBA DE AGUA, ALDEA ENTRE RIOS",79475263,ELENA ELIZABETH SUCHITE GARNICA DE QUINTANILLA,LUIS ALBERTO CARCAMO PEÑA,DIVERSIFICADO,PRIVADO,RURAL,ABIERTA,MONOLINGÜE,DOBLE,FIN DE SEMANA,IZABAL
18-01-0115-46,18-005,IZABAL,PUERTO BARRIOS,COLEGIO MIXTO EXPERIMENTAL EDUCARE,7A. CALLE 9A. AVENIDA,,ELENA ELIZABETH SUCHITE GARNICA DE QUINTANILLA,YOLANDA RIVAS MONROY,DIVERSIFICADO,PRIVADO,URBANA,CERRADA TEMPORALMENTE,MONOLINGÜE,MATUTINA,FIN DE SEMANA,IZABAL
18-01-0145-46,18-005,IZABAL,PUERTO BARRIOS,COLEGIO CRISTIANO PRIVADO MIXTO CRISTO VIENE,ALDEA ENTRE RIOS,40620273,ELENA ELIZABETH SUCHITE GARNICA DE QUINTANILLA,GRICELSA MAGALY LEMUS CALDERON,DIVERSIFICADO,PRIVADO,RURAL,ABIERTA,MONOLINGÜE,VESPERTINA,DIARIO(REGULAR),IZABAL
18-01-0153-46,18-005,IZABAL,PUERTO BARRIOS,INSTITUTO PRIVADO MIXTO DE EDUCACIÓN BASICA Y BACHILLERATO POR MADUREZ EL PORVENIR,15 CALLE ENTRE 7A. Y 8A. AVENIDA,58055529,ELENA ELIZABETH SUCHITE GARNICA DE QUINTANILLA,CARLOS ARTURO PALENCIA RIVAS,DIVERSIFICADO,PRIVADO,URBANA,ABIERTA,MONOLINGÜE,DOBLE,FIN DE SEMANA,IZABAL
18-01-0156-46,18-005,IZABAL,PUERTO BARRIOS,ESCUELA PARTICULAR MIXTA JUSTO RUFINO BARRIOS,8A. AVENIDA Y 17 CALLE,79487032,ELENA ELIZABETH SUCHITE GARNICA DE QUINTANILLA,ROSA VICTORIA LEONARDO WELCHES,DIVERSIFICADO,PRIVADO,URBANA,ABIERTA,MONOLINGÜE,DOBLE,FIN DE SEMANA,IZABAL
18-01-0158-46,18-005,IZABAL,PUERTO BARRIOS,COLEGIO PARTICULAR MIXTO PIEDRAS NEGRAS,"COLONIA PIEDRAS NEGRAS, SANTO TOMAS DE CASTILLA",79453597,ELENA ELIZABETH SUCHITE GARNICA DE QUINTANILLA,LASTENIA CARIAS SAMAYOA,DIVERSIFICADO,PRIVADO,RURAL,ABIERTA,MONOLINGÜE,VESPERTINA,DIARIO(REGULAR),IZABAL
18-01-0162-46,18-005,IZABAL,PUERTO BARRIOS,COLEGIO PARTICULAR MIXTO PIEDRAS NEGRAS,"COLONIA PIEDRAS NEGRAS, SANTO TOMÁS DE CASTILLA",7948439141051885,ELENA ELIZABETH SUCHITE GARNICA DE QUINTANILLA,LASTENIA CARIAS SAMAYOA,DIVERSIFICADO,PRIVADO,RURAL,ABIERTA,MONOLINGÜE,DOBLE,FIN DE SEMANA,IZABAL
18-01-0164-46,18-005,IZABAL,PUERTO BARRIOS,LICEO TECNICO GUATEMALTECO IDETI,ALDEA PLACA NO. 1,57843058,ELENA ELIZABETH SUCHITE GARNICA DE QUINTANILLA,LAURA PATRICIA VALDEZ SALGUERO,DIVERSIFICADO,PRIVADO,RURAL,ABIERTA,MONOLINGÜE,VESPERTINA,DIARIO(REGULAR),IZABAL
18-01-0167-46,18-005,IZABAL,PUERTO BARRIOS,COLEGIO CRISTIANO MARANATHA,7A. AVENIDA ENTRE 16A. Y 17A. CALLES,79429163,ELENA ELIZABETH SUCHITE GARNICA DE QUINTANILLA,MARIA OSORIO DE QUINTO,DIVERSIFICADO,PRIVADO,URBANA,CERRADA TEMPORALMENTE,MONOLINGÜE,DOBLE,FIN DE SEMANA,IZABAL
18-01-0168-46,18-005,IZABAL,PUERTO BARRIOS,COLEGIO CRISTIANO MARANATHA,7A. AVENIDA ENTRE 16A. Y 17A. CALLES,79429136,ELENA ELIZABETH SUCHITE GARNICA DE QUINTANILLA,MARIA OSORIO DE QUINTO,DIVERSIFICADO,PRIVADO,URBANA,ABIERTA,MONOLINGÜE,VESPERTINA,DIARIO(REGULAR),IZABAL
18-01-0173-46,18-006,IZABAL,PUERTO BARRIOS,INSTITUTO NACIÓNAL DE EDUCACIÓN DIVERSIFICADA,COLONIA SAN MANUEL,41237549,CYNTHIA AZUCELLY BARRIENTOS LOPEZ,ELIA ERSELI FRANCO CALDERON,DIVERSIFICADO,OFICIAL,RURAL,ABIERTA,MONOLINGÜE,MATUTINA,DIARIO(REGULAR),IZABAL
18-01-0174-46,18-006,IZABAL,PUERTO BARRIOS,INSTITUTO NACIÓNAL DE EDUCACIÓN DIVERSIFICADA,COLONIA MARIA LUISA I,79484363,CYNTHIA AZUCELLY BARRIENTOS LOPEZ,ROSA ORFILIA ESQUIVEL AVILA DE GUZMAN,DIVERSIFICADO,OFICIAL,RURAL,ABIERTA,MONOLINGÜE,VESPERTINA,DIARIO(REGULAR),IZABAL
18-01-0182-46,18-005,IZABAL,PUERTO BARRIOS,INSTITUTO PARTICULAR MIXTO DESARROLLO Y CIENCIA,14 CALLE ENTRE 11 AVENIDA,79486407,ELENA ELIZABETH SUCHITE GARNICA DE QUINTANILLA,EDGAR ROMEO MARTINEZ CACERES,DIVERSIFICADO,PRIVADO,URBANA,ABIERTA,MONOLINGÜE,DOBLE,FIN DE SEMANA,IZABAL
18-01-0200-46,18-005,IZABAL,PUERTO BARRIOS,INSTITUTO PREUNIVERSITARIO DE IZABAL PREU,COLONIA SAN CRISTOBAL ENTRE RIOS,49026498,ELENA ELIZABETH SUCHITE GARNICA DE QUINTANILLA,FREDY ANTONIO FLORES LOPEZ,DIVERSIFICADO,PRIVADO,URBANA,ABIERTA,MONOLINGÜE,DOBLE,FIN DE SEMANA,IZABAL
18-01-0203-46,18-005,IZABAL,PUERTO BARRIOS,INSTITUTO PREUNIVERSITARIO DE IZABAL PREU,COLONIA SAN CRISTOBAL ENTRE RIOS,57864086,ELENA ELIZABETH SUCHITE GARNICA DE QUINTANILLA,FREDY ANTONIO FLORES LOPEZ,DIVERSIFICADO,PRIVADO,URBANA,CERRADA TEMPORALMENTE,MONOLINGÜE,MATUTINA,DIARIO(REGULAR),IZABAL
18-01-0205-46,18-005,IZABAL,PUERTO BARRIOS,INSTITUTO PREUNIVERSITARIO DE IZABAL PREU,COLONIA SAN CRISTOBAL ENTRE RIOS,49026498,ELENA ELIZABETH SUCHITE GARNICA DE QUINTANILLA,FREDY ANTONIO FLORES LOPEZ,DIVERSIFICADO,PRIVADO,URBANA,ABIERTA,MONOLINGÜE,VESPERTINA,DIARIO(REGULAR),IZABAL
18-01-0206-46,18-005,IZABAL,PUERTO BARRIOS,CENTRO EDUCATIVO LICEO CENTROAMERICANO,5A.CALLE ENTRE 3A. Y 4A. AVENIDA,47193485,ELENA ELIZABETH SUCHITE GARNICA DE QUINTANILLA,WALTER DANILO MONTERROSO JIMENEZ,DIVERSIFICADO,PRIVADO,URBANA,ABIERTA,MONOLINGÜE,VESPERTINA,DIARIO(REGULAR),IZABAL
18-01-0209-46,18-005,IZABAL,PUERTO BARRIOS,CENTRO EDUCATIVO LICEO CENTROAMERICANO,5A.CALLE ENTRE 3A. Y 4A. AVENIDA,47193485,ELENA ELIZABETH SUCHITE GARNICA DE QUINTANILLA,WALTER DANILO MONTERROSO JIMENEZ,DIVERSIFICADO,PRIVADO,URBANA,ABIERTA,MONOLINGÜE,DOBLE,FIN DE SEMANA,IZABAL
18-01-0211-46,18-005,IZABAL,PUERTO BARRIOS,COLEGIO CRISTIANO PRIVADO MIXTO CRISTO VIENE,ALDEA ENTRE RIOS,79475041,ELENA ELIZABETH SUCHITE GARNICA DE QUINTANILLA,GRICELDA MAGALY LEMUS CALDERON,DIVERSIFICADO,PRIVADO,RURAL,ABIERTA,MONOLINGÜE,DOBLE,FIN DE SEMANA,IZABAL
18-01-0218-46,18-005,IZABAL,PUERTO BARRIOS,CENTRO EDUCATIVO CONCEPCIÓN DE MARIA,"COLONIA 15 DE ABRIL, SANTO TOMAS DE CASTILLA",79484943,ELENA ELIZABETH SUCHITE GARNICA DE QUINTANILLA,MIGUEL SALAZAR PEREZ,DIVERSIFICADO,PRIVADO,RURAL,CERRADA TEMPORALMENTE,MONOLINGÜE,VESPERTINA,DIARIO(REGULAR),IZABAL
18-01-0221-46,18-005,IZABAL,PUERTO BARRIOS,CENTRO EDUCATIVO CONCEPCIÓN DE MARIA,"COLONIA 15 DE ABRIL, SANTO TOMAS DE CASTILLA",79484943,ELENA ELIZABETH SUCHITE GARNICA DE QUINTANILLA,MIGUEL SALAZAR PEREZ,DIVERSIFICADO,PRIVADO,RURAL,CERRADA TEMPORALMENTE,MONOLINGÜE,MATUTINA,DIARIO(REGULAR),IZABAL
18-01-0232-46,18-005,IZABAL,PUERTO BARRIOS,CENTRO EDUCATIVO CONCEPCIÓN DE MARIA,"COLONIA 15 DE ABRIL, SANTO TOMAS DE CASTILLA",79484943,ELENA ELIZABETH SUCHITE GARNICA DE QUINTANILLA,EVELYN MARILU FRANCO ALDANA DE CHUPINA,DIVERSIFICADO,PRIVADO,RURAL,ABIERTA,MONOLINGÜE,DOBLE,FIN DE SEMANA,IZABAL
18-01-0234-46,18-005,IZABAL,PUERTO BARRIOS,LICEO EDUCACIÓNAL INTERACTIVO LEI,12 AV. 10 Y 11 CALLE,42238214,ELENA ELIZABETH SUCHITE GARNICA DE QUINTANILLA,ERWIN FERNANDO GUZMAN OVALLE,DIVERSIFICADO,PRIVADO,URBANA,CERRADA TEMPORALMENTE,MONOLINGÜE,VESPERTINA,DIARIO(REGULAR),IZABAL
18-01-0237-46,18-005,IZABAL,PUERTO BARRIOS,LICEO TECNICO GUATEMALTECO IDETI,ALDEA LA PLACA NO. 1,45022811,ELENA ELIZABETH SUCHITE GARNICA DE QUINTANILLA,JACOBO AREVALO MEDINA,DIVERSIFICADO,PRIVADO,RURAL,CERRADA TEMPORALMENTE,MONOLINGÜE,DOBLE,FIN DE SEMANA,IZABAL
18-01-0238-46,18-006,IZABAL,PUERTO BARRIOS,INSTITUTO OFICIAL DE EDUCACIÓN BASICA Y BACHILLERATO EN CIENCIAS Y LETRAS POR MADUREZ TIERRA DE DIOS,INTERIOR CENTRO DE REHABILITACIÓN,79480495,CYNTHIA AZUCELLY BARRIENTOS LOPEZ,BRENDA ZULY YATZ MEJIA,DIVERSIFICADO,OFICIAL,URBANA,ABIERTA,MONOLINGÜE,MATUTINA,DIARIO(REGULAR),IZABAL
18-01-0242-46,18-005,IZABAL,PUERTO BARRIOS,INSTITUTO PARTICULAR MIXTO JOSE MARIA BONILLA RUANO,19 CALLE 14 AVENIDAS,53108367,ELENA ELIZABETH SUCHITE GARNICA DE QUINTANILLA,GUSTAVO GUMERCINDO RODAS MAZARIEGOS,DIVERSIFICADO,PRIVADO,URBANA,ABIERTA,MONOLINGÜE,DOBLE,FIN DE SEMANA,IZABAL
18-01-0246-46,18-005,IZABAL,PUERTO BARRIOS,COLEGIO PARTICULAR MIXTO SHADDAI,"COLONIA SAN AGUSTIN, DE SANTO TOMAS DE CASTILLA",79453430,ELENA ELIZABETH SUCHITE GARNICA DE QUINTANILLA,HERLINDO ARTIGA MARROQUIN,DIVERSIFICADO,PRIVADO,RURAL,ABIERTA,MONOLINGÜE,VESPERTINA,DIARIO(REGULAR),IZABAL
18-01-0254-46,18-005,IZABAL,PUERTO BARRIOS,INSTITUTO MIXTO INTEGRAL MARIA CHINCHILLA,4A. AVENIDA ENTRE 12 Y 13 CALLES,44641742,ELENA ELIZABETH SUCHITE GARNICA DE QUINTANILLA,WALTER FRANCISCO LOPEZ TOBAR,DIVERSIFICADO,PRIVADO,URBANA,CERRADA TEMPORALMENTE,MONOLINGÜE,DOBLE,FIN DE SEMANA,IZABAL
18-01-0264-46,18-005,IZABAL,PUERTO BARRIOS,LICEO EDUCACIÓNAL MIXTO CRISTIANO VIDA NUEVA,13 AV. ENTRE 14 Y 15 CALLES,54454685,ELENA ELIZABETH SUCHITE GARNICA DE QUINTANILLA,SANDRA LILIANA MAYORGA PEREZ DE COTTO,DIVERSIFICADO,PRIVADO,URBANA,CERRADA TEMPORALMENTE,MONOLINGÜE,DOBLE,SABATINO,IZABAL
18-01-0277-46,18-005,IZABAL,PUERTO BARRIOS,INSTITUTO DE EDUCACIÓN BASICA Y BACHILLERATO POR MADUREZ EMPORNAC,ZONA URBANIZADA PUERTO SANTO TOMAS DE CASTILLA,77204040,ELENA ELIZABETH SUCHITE GARNICA DE QUINTANILLA,SERGIO GIRON PINALES,DIVERSIFICADO,PRIVADO,URBANA,CERRADA TEMPORALMENTE,MONOLINGÜE,DOBLE,DIARIO(REGULAR),IZABAL
18-01-0284-46,18-005,IZABAL,PUERTO BARRIOS,LICEO EDUCATIVO DE FORMACIÓN INTEGRAL FUENTE DE VIDA,CASERIO COLINA II DE SANTO TOMAS DE CASTILLA,50218402,ELENA ELIZABETH SUCHITE GARNICA DE QUINTANILLA,HEIDI YESENIA VASQUEZ MORALES,DIVERSIFICADO,PRIVADO,RURAL,ABIERTA,MONOLINGÜE,DOBLE,FIN DE SEMANA,IZABAL
18-01-0286-46,18-005,IZABAL,PUERTO BARRIOS,COLEGIO PARTICULAR MIXTO MATIAS DE GALVEZ,COLONIA PIEDRAS NEGRAS,50157184,ELENA ELIZABETH SUCHITE GARNICA DE QUINTANILLA,MARIA MAGDALENA SUCHITE GARNICA,DIVERSIFICADO,PRIVADO,RURAL,CERRADA TEMPORALMENTE,MONOLINGÜE,VESPERTINA,DIARIO(REGULAR),IZABAL
18-01-0291-46,18-005,IZABAL,PUERTO BARRIOS,INSTITUTO DE FORMACIÓN TECNOLOGICO PORTEÑO INFOTECPO,12 AVENIDA ENTRE 12 Y 13 CALLES,79524625,ELENA ELIZABETH SUCHITE GARNICA DE QUINTANILLA,SILVIA LETICIA LEMUS,DIVERSIFICADO,PRIVADO,URBANA,CERRADA TEMPORALMENTE,MONOLINGÜE,VESPERTINA,DIARIO(REGULAR),IZABAL
18-01-0292-46,18-005,IZABAL,PUERTO BARRIOS,INSTITUTO DE FORMACIÓN TECNOLOGICO PORTEÑO INFOTECPO,12 AVENIDA ENTRE 12 Y 13 CALLES,79524625,ELENA ELIZABETH SUCHITE GARNICA DE QUINTANILLA,SILVIA LETICIA LEMUS,DIVERSIFICADO,PRIVADO,URBANA,CERRADA TEMPORALMENTE,MONOLINGÜE,NOCTURNA,DIARIO(REGULAR),IZABAL
18-01-0300-46,18-036,IZABAL,PUERTO BARRIOS,"INSTITUTO TECNICO DE CAPACITACIÓN Y PRODUCTIVIDAD, INTECAP",SANTO TOMAS DE CASTILLA,79483012,DANY ARELY IBARRA MEJIA,NORA EUGENIA DIAZ DIAZ,DIVERSIFICADO,PRIVADO,RURAL,ABIERTA,MONOLINGÜE,MATUTINA,DIARIO(REGULAR),IZABAL
18-01-0305-46,18-005,IZABAL,PUERTO BARRIOS,INSTITUTO INTERCULTURAL MIXTO KATOK WINAQ,21 CALLE 14 AVENIDA,7948643379480166,ELENA ELIZABETH SUCHITE GARNICA DE QUINTANILLA,CINTHYA MARIBEL DIAZ ALDANA DE LINARES,DIVERSIFICADO,PRIVADO,URBANA,CERRADA TEMPORALMENTE,MONOLINGÜE,DOBLE,FIN DE SEMANA,IZABAL
18-01-0313-46,18-005,IZABAL,PUERTO BARRIOS,COLEGIO MIXTO BILINGÜE QUETZALLI,"3A. CALLE 15A. AVENIDA, COLONIA LAS FLORES, SANTO TOMAS DE CASTILLA",79600197,ELENA ELIZABETH SUCHITE GARNICA DE QUINTANILLA,JUAN CARLOS LUCERO ALVARADO,DIVERSIFICADO,PRIVADO,RURAL,ABIERTA,MONOLINGÜE,MATUTINA,DIARIO(REGULAR),IZABAL
18-01-0317-46,18-006,IZABAL,PUERTO BARRIOS,INSTITUTO NACIÓNAL DE EDUCACIÓN DIVERSIFICADA INED,ALDEA SANTO TOMAS DE CASTILLA,41568056,CYNTHIA AZUCELLY BARRIENTOS LOPEZ,HUGO RANDOLFO BARRIENTOS MENDEZ,DIVERSIFICADO,OFICIAL,RURAL,ABIERTA,MONOLINGÜE,VESPERTINA,DIARIO(REGULAR),IZABAL
18-01-0320-46,18-005,IZABAL,PUERTO BARRIOS,COLEGIO PARTICULAR MIXTO MATÍAS DE GÁLVEZ,"COLONIA PIEDRAS NEGRAS, ALDEA SANTO TOMÁS DE CASTILLA",77600249,ELENA ELIZABETH SUCHITE GARNICA DE QUINTANILLA,MARIA MAGDALENA SÚCHITE GARNICA,DIVERSIFICADO,PRIVADO,RURAL,ABIERTA,MONOLINGÜE,DOBLE,FIN DE SEMANA,IZABAL
18-01-0325-46,18-005,IZABAL,PUERTO BARRIOS,INSTITUTO PARTICULAR MIXTO EL DIVINO MAESTRO,BARRIO EL PUEBLITO ALDEA SANTO TOMAS DE CASTILLA,79484009,ELENA ELIZABETH SUCHITE GARNICA DE QUINTANILLA,MANUEL DE JESÚS SAGASTUME CASASOLA,DIVERSIFICADO,PRIVADO,RURAL,ABIERTA,MONOLINGÜE,DOBLE,FIN DE SEMANA,IZABAL
18-01-0326-46,18-005,IZABAL,PUERTO BARRIOS,COLEGIO LUTERANO CRISTO EL SALVADOR,4A. AVENIDA 12-13 CALLES,79488357,ELENA ELIZABETH SUCHITE GARNICA DE QUINTANILLA,RICARDO AUGUSTO CASASOLA ANLEU,DIVERSIFICADO,PRIVADO,URBANA,ABIERTA,MONOLINGÜE,VESPERTINA,DIARIO(REGULAR),IZABAL
18-01-0327-46,18-005,IZABAL,PUERTO BARRIOS,COLEGIO PRIVADO MIXTO ECOLOGICO CAMPO Y VIDA,ALDEA AGUA CALIENTE,7960087046007362,ELENA ELIZABETH SUCHITE GARNICA DE QUINTANILLA,SHAWNY YUBITZA GISELL PEÑA AGUSTIN,DIVERSIFICADO,PRIVADO,RURAL,ABIERTA,MONOLINGÜE,MATUTINA,DIARIO(REGULAR),IZABAL
18-01-0337-46,18-006,IZABAL,PUERTO BARRIOS,INED PROF. HUGO LEONEL SANCÉ CETINO,21 CALLE 5A. Y 6A. AVENIDAS,54667746,CYNTHIA AZUCELLY BARRIENTOS LOPEZ,HUGO LEONEL SANCÉ CETINO,DIVERSIFICADO,OFICIAL,URBANA,ABIERTA,MONOLINGÜE,VESPERTINA,DIARIO(REGULAR),IZABAL
18-01-0339-46,18-005,IZABAL,PUERTO BARRIOS,LICEO MIXTO BILINGÜE CANADIENSE,7A. CALLE ENTRE 6A. Y 7A. AVENIDAS,79480085,ELENA ELIZABETH SUCHITE GARNICA DE QUINTANILLA,WILMER EZEQUIEL MONGE MARTINEZ,DIVERSIFICADO,PRIVADO,URBANA,CERRADA TEMPORALMENTE,MONOLINGÜE,VESPERTINA,DIARIO(REGULAR),IZABAL
18-01-0340-46,18-005,IZABAL,PUERTO BARRIOS,LICEO MIXTO BILINGÜE CANADIENSE,7A. CALLE ENTRE 6A. Y 7A. AVENIDAS,79480085,ELENA ELIZABETH SUCHITE GARNICA DE QUINTANILLA,WILMER EZEQUIEL MONGE MARTINEZ,DIVERSIFICADO,PRIVADO,URBANA,CERRADA TEMPORALMENTE,MONOLINGÜE,MATUTINA,DIARIO(REGULAR),IZABAL
18-01-0343-46,18-005,IZABAL,PUERTO BARRIOS,LICEO MIXTO BILINGÜE CANADIENSE,7A. CALLE ENTRE 6A. Y 7A. AVENIDAS,79480085,ELENA ELIZABETH SUCHITE GARNICA DE QUINTANILLA,WILMER EZEQUIEL MONGE MARTINEZ,DIVERSIFICADO,PRIVADO,URBANA,ABIERTA,MONOLINGÜE,DOBLE,FIN DE SEMANA,IZABAL
18-01-0344-46,18-005,IZABAL,PUERTO BARRIOS,LICEO MIXTO BINLINGÜE CANADIENSE,7A. CALLE ENTRE 6A. Y 7A. AVENIDAS,79480085,ELENA ELIZABETH SUCHITE GARNICA DE QUINTANILLA,WILMER EZEQUIEL MONGE MARTINEZ,DIVERSIFICADO,PRIVADO,URBANA,ABIERTA,MONOLINGÜE,DOBLE,FIN DE SEMANA,IZABAL
18-01-0350-46,18-005,IZABAL,PUERTO BARRIOS,COLEGIO TECNICO PRIVADO MIXTO SAN JOSE,ALDEA MEDIA LUNA,41558965,ELENA ELIZABETH SUCHITE GARNICA DE QUINTANILLA,LUIS ALBERTO CARCAMO PEÑA,DIVERSIFICADO,PRIVADO,RURAL,CERRADA TEMPORALMENTE,MONOLINGÜE,DOBLE,FIN DE SEMANA,IZABAL
18-01-0352-46,18-005,IZABAL,PUERTO BARRIOS,LICEO EDUCATIVO DE FORMACIÓN INTEGRAL FUENTE DE VIDA,"CASERIO COLINA II, ALDEA SANTO TOMAS DE CASTILLA",50218402,ELENA ELIZABETH SUCHITE GARNICA DE QUINTANILLA,HEIDI YESENIA VASQUEZ MORALES,DIVERSIFICADO,PRIVADO,RURAL,ABIERTA,MONOLINGÜE,VESPERTINA,DIARIO(REGULAR),IZABAL
18-01-0356-46,18-005,IZABAL,PUERTO BARRIOS,COLEGIO PRIVADO MIXTO SAN JOSE,"BARRIO EL PUEBLITO, SANTO TOMAS DE CASTILLA",79484877,ELENA ELIZABETH SUCHITE GARNICA DE QUINTANILLA,LESVIA LINETH CARDONA NOVA DE SANDOVAL,DIVERSIFICADO,PRIVADO,RURAL,ABIERTA,MONOLINGÜE,VESPERTINA,DIARIO(REGULAR),IZABAL
18-01-0358-46,18-005,IZABAL,PUERTO BARRIOS,COLEGIO MIXTO BILINGÜE QUETZALLI,"3A. CALLE Y 15 AVENIDA, COLONIA LAS FLORES, SANTO TOMAS DE CASTILLA",79600197,ELENA ELIZABETH SUCHITE GARNICA DE QUINTANILLA,JUAN CARLOS LUCERO ALVARADO,DIVERSIFICADO,PRIVADO,RURAL,ABIERTA,MONOLINGÜE,DOBLE,FIN DE SEMANA,IZABAL
18-01-0359-46,18-005,IZABAL,PUERTO BARRIOS,COLEGIO PARTICULAR MIXTO MIGUEL ANGEL ASTURIAS,11 CALLE ENTRE 10 Y 11 AVENIDAS,79481153,ELENA ELIZABETH SUCHITE GARNICA DE QUINTANILLA,DINA ESPERANZA MEJIA HERNANDEZ,DIVERSIFICADO,PRIVADO,URBANA,ABIERTA,MONOLINGÜE,DOBLE,FIN DE SEMANA,IZABAL
18-01-0365-46,18-005,IZABAL,PUERTO BARRIOS,LICEO DR. LUIS VON AHN,12 AVENIDA ENTRE 10 Y 11 CALLES,5843105979524680,ELENA ELIZABETH SUCHITE GARNICA DE QUINTANILLA,JOSE FRANCISCO ALFARO PAZ,DIVERSIFICADO,PRIVADO,URBANA,ABIERTA,MONOLINGÜE,VESPERTINA,DIARIO(REGULAR),IZABAL
18-01-0368-46,18-005,IZABAL,PUERTO BARRIOS,COLEGIO CRISTIANO MIXTO BILINGÜE MI DULCE PARAISO,"4A, CALLE 15 AVENIDA, COLONIA SAN AGUSTIN, ALDEA SANTO TOMAS DE CASTILLA",79524378,ELENA ELIZABETH SUCHITE GARNICA DE QUINTANILLA,MAGGIE SHAUNNY MAHLI MUÑOZ SALGUERO,DIVERSIFICADO,PRIVADO,RURAL,ABIERTA,MONOLINGÜE,VESPERTINA,DIARIO(REGULAR),IZABAL
18-01-0369-46,18-005,IZABAL,PUERTO BARRIOS,COLEGIO BILINGÜE ABC,13 CALLE 5A. Y 6A.,79429590,ELENA ELIZABETH SUCHITE GARNICA DE QUINTANILLA,DORA LETICIA CARDONA DE LA CRUZ,DIVERSIFICADO,PRIVADO,URBANA,ABIERTA,MONOLINGÜE,DOBLE,DIARIO(REGULAR),IZABAL
18-01-0376-46,18-005,IZABAL,PUERTO BARRIOS,INSTITUTO PARTICULAR MIXTO ADONAI,CASERIO LA REFINERIA,54837080,ELENA ELIZABETH SUCHITE GARNICA DE QUINTANILLA,SANDRA PATRICIA LOPEZ JORDAN,DIVERSIFICADO,PRIVADO,URBANA,ABIERTA,MONOLINGÜE,DOBLE,FIN DE SEMANA,IZABAL
18-01-0379-46,18-005,IZABAL,PUERTO BARRIOS,LICEO TECNICO VOCACIÓNAL MAYA,22 CALLE 7A. Y 8A. AVENIDA,79481614,ELENA ELIZABETH SUCHITE GARNICA DE QUINTANILLA,PERLA AMY ONDRA FORBES NICHOLAS,DIVERSIFICADO,PRIVADO,URBANA,ABIERTA,MONOLINGÜE,DOBLE,FIN DE SEMANA,IZABAL
18-01-0380-46,18-006,IZABAL,PUERTO BARRIOS,ESCUELA TECNICA DE FORMACIÓN Y CAPACITACIÓN DE DESARROLLOS HOTELEROS INTERNATIONAL,FINCA PICHILINGO,79311231,CYNTHIA AZUCELLY BARRIENTOS LOPEZ,BRIANDA CAROLINA MIRANDA FAJARDO,DIVERSIFICADO,PRIVADO,URBANA,ABIERTA,MONOLINGÜE,DOBLE,FIN DE SEMANA,IZABAL
18-01-0385-46,18-005,IZABAL,PUERTO BARRIOS,COLEGIO PARTICULAR MIXTO RAFAEL ALVAREZ OVALLE,ALDEA EL COROZO MILLA 4,53444994,ELENA ELIZABETH SUCHITE GARNICA DE QUINTANILLA,HEIDY ALEJANDRA ALDANA LOPEZ,DIVERSIFICADO,PRIVADO,RURAL,ABIERTA,MONOLINGÜE,DOBLE,FIN DE SEMANA,IZABAL
18-01-0394-46,18-005,IZABAL,PUERTO BARRIOS,LICEO DR. LUIS VON AHN,12 AVENIDA ENTRE 10 Y 11 CALLES,79480009,ELENA ELIZABETH SUCHITE GARNICA DE QUINTANILLA,JOSE FRANCISCO ALFARO PAZ,DIVERSIFICADO,PRIVADO,URBANA,ABIERTA,MONOLINGÜE,DOBLE,FIN DE SEMANA,IZABAL
18-01-0400-46,18-005,IZABAL,PUERTO BARRIOS,CENTRO EDUCATIVO DE FORMACIÓN INTEGRAL SAN MARTÍN DE PORRES,5A AVENIDA ENTRE 3A. Y 4A. CALLES,41542920,ELENA ELIZABETH SUCHITE GARNICA DE QUINTANILLA,GUSTAVO ADOLFO BATRES ESPINOZA,DIVERSIFICADO,PRIVADO,URBANA,ABIERTA,MONOLINGÜE,DOBLE,FIN DE SEMANA,IZABAL
18-01-0402-46,18-036,IZABAL,PUERTO BARRIOS,CENTRO DE DESARROLLO HUMANO TECNOLOGICO ASOCIACIÓN GRUPO CEIBA,"COLONIA SAN AGUSTIN, ALDEA SANTO TOMAS DE CASTILLA",57175702,DANY ARELY IBARRA MEJIA,MARIA DEL CARMEN URIZAR CATALAN,DIVERSIFICADO,PRIVADO,RURAL,ABIERTA,MONOLINGÜE,DOBLE,FIN DE SEMANA,IZABAL
18-01-0657-46,18-005,IZABAL,PUERTO BARRIOS,INSTITUTO PRIVADO MIXTO DE EDUCACIÓN DIVERSIFICADA LICEO MONTESSORI JV,12 AVENIDA ENTRE 10 Y 11 CALLES,79480774,ELENA ELIZABETH SUCHITE GARNICA DE QUINTANILLA,MIGUEL DANILO MONTERROSO,DIVERSIFICADO,PRIVADO,URBANA,CERRADA TEMPORALMENTE,MONOLINGÜE,VESPERTINA,DIARIO(REGULAR),IZABAL
18-01-0658-46,18-005,IZABAL,PUERTO BARRIOS,INSTITUTO PRIVADO MIXTO DE EDUCACIÓN DIVERSIFICADA EL DIVINO MAESTRO JN,"CALZADA AL CAMPO DE DIOS, BARRIO EL PUEBLITO",79484009,ELENA ELIZABETH SUCHITE GARNICA DE QUINTANILLA,MANUEL DE JESUS SAGASTUME CASASOLA,DIVERSIFICADO,PRIVADO,URBANA,CERRADA TEMPORALMENTE,MONOLINGÜE,NOCTURNA,DIARIO(REGULAR),IZABAL
18-01-0695-46,18-005,IZABAL,PUERTO BARRIOS,INSTITUTO PARTICULAR MIXTO CIENCIA Y DESARROLLO,14 CALLE 12 AVENIDA,79486407,ELENA ELIZABETH SUCHITE GARNICA DE QUINTANILLA,EDGAR ROMEO MARTÍNEZ CÁCERES,DIVERSIFICADO,PRIVADO,URBANA,CERRADA TEMPORALMENTE,MONOLINGÜE,DOBLE,FIN DE SEMANA,IZABAL
18-01-0710-46,18-005,IZABAL,PUERTO BARRIOS,COLEGIO PARTICULAR MIXTO MIGUEL ANGEL ASTURIAS,11 CALLE ENTRE 10 Y 11 AVENIDA,79482219,ELENA ELIZABETH SUCHITE GARNICA DE QUINTANILLA,,DIVERSIFICADO,PRIVADO,URBANA,CERRADA TEMPORALMENTE,MONOLINGÜE,NOCTURNA,DIARIO(REGULAR),IZABAL
18-01-0711-46,,IZABAL,PUERTO BARRIOS,INSTITUTO PRIVADO MIXTO DE EDUCACIÓN BASICA ASOPROBA,FINCA ESKIMO,,,,DIVERSIFICADO,PRIVADO,URBANA,CERRADA TEMPORALMENTE,MONOLINGÜE,NOCTURNA,DIARIO(REGULAR),IZABAL
18-01-0746-46,18-005,IZABAL,PUERTO BARRIOS,COLEGIO DE CIENCIAS DE LA COMPUTACIÓN,8A. AVENIDA Y 10A. CALLE,79480009,ELENA ELIZABETH SUCHITE GARNICA DE QUINTANILLA,MIGUEL DANILO MONTERROSO,DIVERSIFICADO,PRIVADO,URBANA,CERRADA TEMPORALMENTE,MONOLINGÜE,MATUTINA,DIARIO(REGULAR),IZABAL
18-01-1025-46,18-005,IZABAL,PUERTO BARRIOS,COLEGIO PARTICULAR MIXTO MIGUEL ANGEL ASTURIAS JM,11 CALLE ENTRE 10 Y 11 AVENIDA,79481153,ELENA ELIZABETH SUCHITE GARNICA DE QUINTANILLA,DINA ESPERANZA HERNANDEZ MEJIA,DIVERSIFICADO,PRIVADO,URBANA,ABIERTA,MONOLINGÜE,MATUTINA,DIARIO(REGULAR),IZABAL
18-01-1134-46,18-005,IZABAL,PUERTO BARRIOS,COLEGIO PARTICULAR MIXTO MIGUEL ANGEL ASTURIAS,11 CALLE Y 10 Y 11 AVENIDAS,79481153,ELENA ELIZABETH SUCHITE GARNICA DE QUINTANILLA,DINA ESPERANZA HERNANDEZ MEJIA,DIVERSIFICADO,PRIVADO,URBANA,ABIERTA,MONOLINGÜE,VESPERTINA,DIARIO(REGULAR),IZABAL
18-01-1969-46,18-005,IZABAL,PUERTO BARRIOS,INSTITUTO PARTICULAR MIXTO EL DIVINO MAESTRO,"CALZADA CAMPO DE DIOS, BARRIO EL PUEBLITO",79484009,ELENA ELIZABETH SUCHITE GARNICA DE QUINTANILLA,MANUEL DE JESUS SAGASTUME CASASOLA,DIVERSIFICADO,PRIVADO,URBANA,ABIERTA,MONOLINGÜE,VESPERTINA,DIARIO(REGULAR),IZABAL
18-01-2004-46,18-005,IZABAL,PUERTO BARRIOS,COLEGIO DE CIENCIAS DE LA COMPUTACIÓN,8A. AVENIDA Y 10A. CALLE,,ELENA ELIZABETH SUCHITE GARNICA DE QUINTANILLA,,DIVERSIFICADO,PRIVADO,URBANA,CERRADA TEMPORALMENTE,MONOLINGÜE,NOCTURNA,DIARIO(REGULAR),IZABAL
18-01-2387-46,18-005,IZABAL,PUERTO BARRIOS,COLEGIO VOCACIÓNAL ITZAGUAL,19 CALLE 4A. AVENIDA,79480332,ELENA ELIZABETH SUCHITE GARNICA DE QUINTANILLA,,DIVERSIFICADO,PRIVADO,URBANA,CERRADA TEMPORALMENTE,MONOLINGÜE,VESPERTINA,DIARIO(REGULAR),IZABAL
18-01-2405-46,18-005,IZABAL,PUERTO BARRIOS,LICEO MIXTO 20 DE OCTUBRE,7A. CALLE ENTRE 6A. Y 7A. AVENIDA,79482254,ELENA ELIZABETH SUCHITE GARNICA DE QUINTANILLA,,DIVERSIFICADO,PRIVADO,URBANA,CERRADA TEMPORALMENTE,MONOLINGÜE,NOCTURNA,DIARIO(REGULAR),IZABAL
18-01-2424-46,18-005,IZABAL,PUERTO BARRIOS,LICEO MIXTO 20 DE OCTUBRE,7A. CALLE ENTRE 6A. Y 7A. AVENIDA,79482254,ELENA ELIZABETH SUCHITE GARNICA DE QUINTANILLA,,DIVERSIFICADO,PRIVADO,URBANA,CERRADA TEMPORALMENTE,MONOLINGÜE,MATUTINA,DIARIO(REGULAR),IZABAL
18-01-2427-46,18-005,IZABAL,PUERTO BARRIOS,INSTITUTO PARTICULAR MIXTO ACADEMICO INTEGRADO I.N.A.I,AVENIDA GENERAL UBICO Y 17 CALLE,79480009,ELENA ELIZABETH SUCHITE GARNICA DE QUINTANILLA,DANIEL HUMBERTO GOMEZ POLANCO,DIVERSIFICADO,PRIVADO,URBANA,TEMPORAL TITULOS,MONOLINGÜE,DOBLE,FIN DE SEMANA,IZABAL
18-01-2453-46,18-006,IZABAL,PUERTO BARRIOS,INED ADSCRITO AL INSTITUTO NACIÓNAL DE EDUCACIÓN BASICA EXPERIMENTAL CON ORIENTACIÓN OCUPACIÓNAL DR. LUIS PASTEUR,9A. AVE. ENTRE 14 Y 17 CALLES,79488096,CYNTHIA AZUCELLY BARRIENTOS LOPEZ,OLGA LETICIA TENAS MARTINEZ,DIVERSIFICADO,OFICIAL,URBANA,ABIERTA,MONOLINGÜE,VESPERTINA,DIARIO(REGULAR),IZABAL
18-01-2487-46,18-006,IZABAL,PUERTO BARRIOS,INSTITUTO DIVERSIFICADO POR COOPERATIVA,9A. AVE. ENTRE 14 Y 17 CALLE,79487047,CYNTHIA AZUCELLY BARRIENTOS LOPEZ,JOSE LUIS JUMIQUE CORONADO,DIVERSIFICADO,COOPERATIVA,URBANA,ABIERTA,MONOLINGÜE,VESPERTINA,DIARIO(REGULAR),IZABAL
18-01-2562-46,18-001,IZABAL,PUERTO BARRIOS,INSTITUTO GUATEMALTECO DE EDUCACIÓN RADIOFONICA (IGER),IZABAL,,JACOBO AREVALO MEDINA,,DIVERSIFICADO,PRIVADO,URBANA,CERRADA TEMPORALMENTE,MONOLINGÜE,MATUTINA,A DISTANCIA,IZABAL
18-01-2642-46,18-006,IZABAL,PUERTO BARRIOS,ESCUELA NORMAL DE EDUCACIÓN FISICA,ALDEA SANTO TOMAS DE CASTILLA,79453875,CYNTHIA AZUCELLY BARRIENTOS LOPEZ,EDITH CONSUELO SIERRA JUAREZ DE MARROQUIN,DIVERSIFICADO,OFICIAL,RURAL,ABIERTA,MONOLINGÜE,DOBLE,DIARIO(REGULAR),IZABAL
18-01-2722-46,18-005,IZABAL,PUERTO BARRIOS,INSTITUTO PARTICULAR MIXTO DE BACH. POR MADUREZ DR. MARIANO GALVEZ,FRENTE AL PARQUE BELGA ALDEA SANTO TOMAS DE CASTILLA,58685566,ELENA ELIZABETH SUCHITE GARNICA DE QUINTANILLA,SINDY MARISOL NUÑEZ VALIENTE,DIVERSIFICADO,PRIVADO,RURAL,ABIERTA,MONOLINGÜE,DOBLE,FIN DE SEMANA,IZABAL
18-01-2733-46,18-005,IZABAL,PUERTO BARRIOS,INSTITUTO PARTICULAR MIXTO EDUCATIVO INTEGRAL (POR MADUREZ),COLONIA SAN MANUEL ALDEA SANTO TOMAS DE CASTILLA,,ELENA ELIZABETH SUCHITE GARNICA DE QUINTANILLA,,DIVERSIFICADO,PRIVADO,URBANA,CERRADA TEMPORALMENTE,MONOLINGÜE,MATUTINA,FIN DE SEMANA,IZABAL
18-01-2823-46,18-005,IZABAL,PUERTO BARRIOS,COLEGIO EDUCATIVO PRIVADO MIXTO DE FORMACIÓN INTEGRAL EN COMPUTACIÓN CEIF COMP,7AV. ENTRE 14 Y 15 CALLE EN PUERTO BARRIOS,79524695,ELENA ELIZABETH SUCHITE GARNICA DE QUINTANILLA,MARCO TULIO FLORES LOPEZ,DIVERSIFICADO,PRIVADO,URBANA,ABIERTA,MONOLINGÜE,DOBLE,FIN DE SEMANA,IZABAL
18-01-2828-46,18-005,IZABAL,PUERTO BARRIOS,LICEO TECNICO VOCACIÓNAL MAYA,22 CALLE 7A. Y 8A. AVENIDA,5293612479481614,ELENA ELIZABETH SUCHITE GARNICA DE QUINTANILLA,MYNOR ALBERTO SANDOVAL,DIVERSIFICADO,PRIVADO,URBANA,ABIERTA,MONOLINGÜE,MATUTINA,DIARIO(REGULAR),IZABAL
18-01-2830-46,18-005,IZABAL,PUERTO BARRIOS,"COLEGIO EDUCATIVO PRIVADO MIXTO DE FORMACIÓN INTEGRAL EN COMPUTACIÓN, CEIF COMP","7A. AVENIDA ENTRE 14 Y 15 CALLE, PUERTO BARRIOS",79524695,ELENA ELIZABETH SUCHITE GARNICA DE QUINTANILLA,MARCO TULIO FLORES LOPEZ,DIVERSIFICADO,PRIVADO,URBANA,ABIERTA,MONOLINGÜE,DOBLE,FIN DE SEMANA,IZABAL
18-01-2834-46,18-005,IZABAL,PUERTO BARRIOS,INSTITUTO DIVERSIFICADO EN TECNOLOGIA Y TRABAJO INDUSTRIAL,17 CALLE Y 8A. AVENIDA,,ELENA ELIZABETH SUCHITE GARNICA DE QUINTANILLA,,DIVERSIFICADO,PRIVADO,URBANA,CERRADA TEMPORALMENTE,MONOLINGÜE,DOBLE,FIN DE SEMANA,IZABAL
