CODIGO,DISTRITO,DEPARTAMENTO,MUNICIPIO,ESTABLECIMIENTO,DIRECCIÓN,TELEFONO,SUPERVISOR,DIRECTOR,NIVEL,SECTOR,AREA,STATUS,MODALIDAD,JORNADA,PLAN,DEPARTAMENTAL
22-01-0014-46,22-013,JUTIAPA,JUTIAPA,ESCUELA NACIÓNAL DE CIENCIAS COMERCIALES,"COMPLEJO EDUCATIVO, BARRIO EL CONDOR",78441241,RONY ESMELTZER RAMOS QUIÑONEZ,,DIVERSIFICADO,OFICIAL,URBANA,ABIERTA,MONOLINGÜE,MATUTINA,DIARIO(REGULAR),JUTIAPA
22-01-0015-46,,JUTIAPA,JUTIAPA,INSTITUTO PRIVADO MIXTO DE EDUCACIÓN DIVERSIFICADA COLEGIO MODERNO JUTIAPANECO,3A. AVENIDA 4-66 ZONA 1,,,,DIVERSIFICADO,PRIVADO,URBANA,CERRADA TEMPORALMENTE,MONOLINGÜE,VESPERTINA,DIARIO(REGULAR),JUTIAPA
22-01-0017-46,22-003,JUTIAPA,JUTIAPA,COLEGIO TECNICO PROFESIONAL SAN CRISTOBAL,7A. CALLE 5-30 ZONA 1,78441530,SANDRA NINETH BONILLA ARCHILA,DELMY MENDEZ DE MONTEROS,DIVERSIFICADO,PRIVADO,URBANA,ABIERTA,MONOLINGÜE,VESPERTINA,DIARIO(REGULAR),JUTIAPA
22-01-0018-46,99-001,JUTIAPA,JUTIAPA,INSTITUTO TECNICO DE CIENCIAS ADMINISTRATIVAS Y COMPUTACIÓN INTECIADCOM,7A. AV. 8-80 ZONA 1 BARRIO LATINO,78442122,SILVIA EUGENIA VALDEZ MONTERROSO DE CARBALLO,,DIVERSIFICADO,PRIVADO,URBANA,CERRADA TEMPORALMENTE,MONOLINGÜE,VESPERTINA,DIARIO(REGULAR),JUTIAPA
22-01-0020-46,22-001,JUTIAPA,JUTIAPA,COLEGIO PARTICULAR MIXTO DE MAGISTERIO,1A. AVENIDA 4-64 ZONA 1,78442157,CECILIA ISABEL ALDECOA CASASOLA DE CASTRO,ISRAEL JOSUE VASQUEZ,DIVERSIFICADO,PRIVADO,URBANA,ABIERTA,MONOLINGÜE,VESPERTINA,DIARIO(REGULAR),JUTIAPA
22-01-0022-46,22-003,JUTIAPA,JUTIAPA,INSTITUTO PRIVADO MIXTO DE EDUCACIÓN DIVERSIFICADA DE MERCADOTECNIA Y PUBLICIDAD DE ORIENTE,5A. AV. 7-35 ZONA 1,78441530,SANDRA NINETH BONILLA ARCHILA,LUIS ANÍBAL MONTEROS,DIVERSIFICADO,PRIVADO,URBANA,ABIERTA,MONOLINGÜE,DOBLE,FIN DE SEMANA,JUTIAPA
22-01-0221-46,22-009,JUTIAPA,JUTIAPA,COLEGIO PARTICULAR MIXTO INTEGRAL EVOLUCIÓN,7A. CALLE 8A. AVENIDA 7-49 ZONA 3 BARRIO EL CHAPARRON,78443090,CARLOS HUMBERTO CRUZ ALAY,MILDRED ESPERANZA VILLANUEVA DE FLORIAN,DIVERSIFICADO,PRIVADO,URBANA,CERRADA TEMPORALMENTE,MONOLINGÜE,VESPERTINA,DIARIO(REGULAR),JUTIAPA
22-01-0254-46,22-001,JUTIAPA,JUTIAPA,LICEO CREZCO APRENDIENDO,"7A. CALLE ENTRE 6A. Y 7A. AVENIDA ZONA 3, BARRIO EL CHAPARRON",78442263,CECILIA ISABEL ALDECOA CASASOLA DE CASTRO,CESAR GEOVANNI RAMOS RAMIREZ,DIVERSIFICADO,PRIVADO,URBANA,ABIERTA,MONOLINGÜE,VESPERTINA,DIARIO(REGULAR),JUTIAPA
22-01-0256-46,22-007,JUTIAPA,JUTIAPA,ESCUELA DE ESTUDIOS PENITENCIARIOS,"3ERA. BRIGADA MILITAR DE INFANTERIA, ALDEA CERRO GORDO",,CARLOS OSWALDO GARCIA GRAJEDA,JULIO MARTIN CASTELLANOS PEÑA,DIVERSIFICADO,PRIVADO,RURAL,CERRADA TEMPORALMENTE,MONOLINGÜE,DOBLE,FIN DE SEMANA,JUTIAPA
22-01-0261-46,22-001,JUTIAPA,JUTIAPA,COLEGIO PARTICULAR MIXTO EL PILAR,5TA. CALLE 5-09 ZONA 1,78446397,CECILIA ISABEL ALDECOA CASASOLA DE CASTRO,SILVIA LILIANA AMAYA RIVERA,DIVERSIFICADO,PRIVADO,URBANA,ABIERTA,MONOLINGÜE,VESPERTINA,DIARIO(REGULAR),JUTIAPA
22-01-0262-46,22-001,JUTIAPA,JUTIAPA,LICEO JUTIAPA,4TA. CALLE 1-53 ZONA 1,78441008,CECILIA ISABEL ALDECOA CASASOLA DE CASTRO,ALVARO CISNEROS QUIÑONEZ,DIVERSIFICADO,PRIVADO,URBANA,ABIERTA,MONOLINGÜE,VESPERTINA,DIARIO(REGULAR),JUTIAPA
22-01-0270-46,22-003,JUTIAPA,JUTIAPA,COLEGIO EL BOSQUE,ALDEA EL CHILTEPE,78442277,SANDRA NINETH BONILLA ARCHILA,INGRID CAROL JUAREZ DOMINGUEZ DE SALGUERO,DIVERSIFICADO,PRIVADO,RURAL,ABIERTA,MONOLINGÜE,MATUTINA,DIARIO(REGULAR),JUTIAPA
22-01-0275-46,22-001,JUTIAPA,JUTIAPA,INSTITUTO TECNOLOGICO BILINGÜE,9A. AVE. 7-59 ZONA 1,78442338,CECILIA ISABEL ALDECOA CASASOLA DE CASTRO,OSIEL DIONICIO VIVAR,DIVERSIFICADO,PRIVADO,URBANA,ABIERTA,MONOLINGÜE,MATUTINA,DIARIO(REGULAR),JUTIAPA
22-01-0277-46,22-003,JUTIAPA,JUTIAPA,INSTITUTO TECNOLOGICO DE COMPUTACIÓN DE ORIENTE ITCO,2A. AVENIDA 4-44 ZONA 1,78442213,SANDRA NINETH BONILLA ARCHILA,MAURO ENRIQUE AZMITIA AGUILAR,DIVERSIFICADO,PRIVADO,URBANA,ABIERTA,MONOLINGÜE,VESPERTINA,DIARIO(REGULAR),JUTIAPA
22-01-0295-46,22-013,JUTIAPA,JUTIAPA,INSTITUTO NACIÓNAL DE EDUCACIÓN DIVERSIFICADA,"COMPLEJO EDUCATIVO, BARRIO EL CONDOR.",58436203,RONY ESMELTZER RAMOS QUIÑONEZ,MARTA LUISA BONILLA GARCIA,DIVERSIFICADO,OFICIAL,URBANA,ABIERTA,MONOLINGÜE,MATUTINA,DIARIO(REGULAR),JUTIAPA
22-01-0300-46,22-003,JUTIAPA,JUTIAPA,COLEGIO PARA TRABAJADORES PROF. CARLOS ARMANDO CÁMBARA GARCÍA,"ENTRADA AL COMPLEJO EDUCATIVO, 0-16 ZONA 3",58251449,SANDRA NINETH BONILLA ARCHILA,EDGAR ARNULFO GONZALEZ GUDIEL,DIVERSIFICADO,PRIVADO,URBANA,ABIERTA,MONOLINGÜE,DOBLE,FIN DE SEMANA,JUTIAPA
22-01-0301-46,22-001,JUTIAPA,JUTIAPA,LICEO BILINGÜE INTERAMERICANO,"KILOMETRO 117 CARRETERA INTERAMERICANA, BARRIO INTERAMERICANO",48300052,CECILIA ISABEL ALDECOA CASASOLA DE CASTRO,ZOILA IRENE ESTRADA Y ESTRADA DE MOLINA,DIVERSIFICADO,PRIVADO,URBANA,ABIERTA,MONOLINGÜE,MATUTINA,DIARIO(REGULAR),JUTIAPA
22-01-0302-46,22-001,JUTIAPA,JUTIAPA,INSTITUTO TÉCNICO PARTICULAR DE DIVERSIFICADO INTECPADI,5TA. CALLE 5-43 ZONA 1,78442296,CECILIA ISABEL ALDECOA CASASOLA DE CASTRO,RONI ERNESTO RECINOS ESTRADA,DIVERSIFICADO,PRIVADO,URBANA,ABIERTA,MONOLINGÜE,MATUTINA,DIARIO(REGULAR),JUTIAPA
22-01-0304-46,22-014,JUTIAPA,JUTIAPA,COLEGIO NUEVOS HORIZONTES,"CASERÍO VILLA HERMOSA, CANTÓN POTRERO GRANDE",55894465,MARCO TULIO CASTILLO MELGAR,MILDRED YESSENIA MARTINEZ CORADO,DIVERSIFICADO,PRIVADO,RURAL,ABIERTA,MONOLINGÜE,VESPERTINA,DIARIO(REGULAR),JUTIAPA
22-01-0306-46,22-001,JUTIAPA,JUTIAPA,CENTRO DE ESTUDIOS DIVERSIFICADOS CED JUTIAPA,ALDEA LAS CRUCITAS,41589757,CECILIA ISABEL ALDECOA CASASOLA DE CASTRO,ROBERTO RENÉ SALGUERO Y SALGUERO,DIVERSIFICADO,PRIVADO,RURAL,ABIERTA,MONOLINGÜE,MATUTINA,DIARIO(REGULAR),JUTIAPA
22-01-0310-46,22-003,JUTIAPA,JUTIAPA,LICEO EDUCATIVO INNOVADOR LEISAR,"7A. AVENIDA 5-24, BARRIO EL CHAPARRON, ZONA 3,",78441031,SANDRA NINETH BONILLA ARCHILA,REGNIER ANTONIO VELASQUEZ DONIS,DIVERSIFICADO,PRIVADO,URBANA,ABIERTA,MONOLINGÜE,VESPERTINA,DIARIO(REGULAR),JUTIAPA
22-01-0326-46,22-013,JUTIAPA,JUTIAPA,LICEO ORIENTAL,"KILOMETRO 116 CARRETERA INTERAMERICANA, ALDEA CERRO GORDO",42198113,RONY ESMELTZER RAMOS QUIÑONEZ,OLIN ROSALINA GUDIEL GRIJALVA,DIVERSIFICADO,PRIVADO,RURAL,ABIERTA,MONOLINGÜE,DOBLE,FIN DE SEMANA,JUTIAPA
22-01-0328-46,22-001,JUTIAPA,JUTIAPA,COLEGIO GUATEMALA,CALLEJON GARCIA GRANADOS 1-16 ZONA 1,78440113,CECILIA ISABEL ALDECOA CASASOLA DE CASTRO,TELMA MARISOL ORDOÑEZ,DIVERSIFICADO,PRIVADO,URBANA,ABIERTA,MONOLINGÜE,VESPERTINA,DIARIO(REGULAR),JUTIAPA
22-01-0334-46,22-003,JUTIAPA,JUTIAPA,ESCUELA EN CIENCIAS DE LA COMUNICACIÓN ECCO II,"6A. CALLE 11-29 ZONA 4 EN RESIDENCIALES SAN VICENTE, BARRIO EL CHAPARRON",78440228,SANDRA NINETH BONILLA ARCHILA,NANCY PAOLA MARTINEZ MEDRANO,DIVERSIFICADO,PRIVADO,URBANA,ABIERTA,MONOLINGÜE,MATUTINA,DIARIO(REGULAR),JUTIAPA
22-01-0336-46,22-003,JUTIAPA,JUTIAPA,COLEGIO PARTICULAR MIXTO GÉNESIS,"08 CALLE 7-33 ZONA 3, BARRIO EL CHAPARRON",78446178,SANDRA NINETH BONILLA ARCHILA,MANUEL LISANDRO LOPEZ SALGUERO,DIVERSIFICADO,PRIVADO,URBANA,ABIERTA,MONOLINGÜE,DOBLE,FIN DE SEMANA,JUTIAPA
22-01-0337-46,22-024,JUTIAPA,JUTIAPA,INSTITUTO DE EDUCACIÓN DIVERSIFICADA POR COOPERATIVA,ALDEA CIUDAD PEDRO ALVARADO,54125788,CARLOS OBDULIO OROZCO REYES,CLAUDIA PATRICIA DAVILA RAMIREZ,DIVERSIFICADO,COOPERATIVA,RURAL,ABIERTA,MONOLINGÜE,VESPERTINA,DIARIO(REGULAR),JUTIAPA
22-01-0342-46,22-001,JUTIAPA,JUTIAPA,COLEGIO SAN FRANCISCO,"2A. CALLE 5-98 ZONA 3, BARRIO LA FEDERAL",78440300,CECILIA ISABEL ALDECOA CASASOLA DE CASTRO,WOLFAND MIKJAIL CASTAÑEDA CASTRO,DIVERSIFICADO,PRIVADO,URBANA,ABIERTA,MONOLINGÜE,DOBLE,FIN DE SEMANA,JUTIAPA
22-01-0343-46,22-003,JUTIAPA,JUTIAPA,LICEO BETHEL,RUTA 23 ALDEA JICARO GRANDE,41607922,SANDRA NINETH BONILLA ARCHILA,DEYSI SINDY JEANETH FLORIAN CARDONA DE FLORIAN,DIVERSIFICADO,PRIVADO,RURAL,ABIERTA,MONOLINGÜE,DOBLE,FIN DE SEMANA,JUTIAPA
22-01-0350-46,22-003,JUTIAPA,JUTIAPA,COLEGIO PARTICULAR MIXTO EBEN EZER,7MA. CALLE Y 8VA. AVENIDA 7-49 ZONA 3,30085046,SANDRA NINETH BONILLA ARCHILA,FIBI JUDITH LEMUS HERNANDEZ,DIVERSIFICADO,PRIVADO,URBANA,ABIERTA,MONOLINGÜE,NOCTURNA,DIARIO(REGULAR),JUTIAPA
22-01-0361-46,22-003,JUTIAPA,JUTIAPA,COLEGIO EVANGÉLICO DE EDUCACIÓN INTEGRAL ELIM,4TA. CALLE 2-05 ZONA 3,49343984,SANDRA NINETH BONILLA ARCHILA,YOLANDA DE JESÚS RODRIGUEZ DE LEÓN,DIVERSIFICADO,PRIVADO,URBANA,ABIERTA,MONOLINGÜE,VESPERTINA,DIARIO(REGULAR),JUTIAPA
22-01-0368-46,22-003,JUTIAPA,JUTIAPA,LICEO TECNOLÓGICO BILINGÜE GÉNESIS,"7A. CALLE Y 8A. AVENIDA 7-49 ZONA 3, BARRIO EL CHAPARRON",78446178,SANDRA NINETH BONILLA ARCHILA,ALBA YESENIA ALARCON HERNANDEZ,DIVERSIFICADO,PRIVADO,URBANA,ABIERTA,MONOLINGÜE,DOBLE,FIN DE SEMANA,JUTIAPA
22-01-0620-46,22-001,JUTIAPA,JUTIAPA,INSTITUTO TECNICO INDUSTRIAL DE ORIENTE,"KILOMETRO 115.5 CARRETERA INTERAMERICANA, ALDEA CERRO GORDO",77252993,CECILIA ISABEL ALDECOA CASASOLA DE CASTRO,LESLY KARINA GOMEZ GARCIA,DIVERSIFICADO,PRIVADO,URBANA,ABIERTA,MONOLINGÜE,DOBLE,DIARIO(REGULAR),JUTIAPA
22-01-0621-46,22-008,JUTIAPA,JUTIAPA,INSTITUTO TECNOLOGICO DE COMPUTACIÓN DE ORIENTE,2A. AVE. 4-44 ZONA 1,78442213,EMMANUEL MONZON HERRERA,MAURO ENRIQUE AZMITIA AGUILAR,DIVERSIFICADO,PRIVADO,URBANA,ABIERTA,MONOLINGÜE,DOBLE,DIARIO(REGULAR),JUTIAPA
22-01-0627-46,22-001,JUTIAPA,JUTIAPA,COLEGIO PARTICULAR MIXTO SAN MIGUEL,6A. CALLE 4-74 ZONA 1,78440300,CECILIA ISABEL ALDECOA CASASOLA DE CASTRO,WOLFANG MIKJAHIL CASTAÑEDA CASTRO,DIVERSIFICADO,PRIVADO,URBANA,ABIERTA,MONOLINGÜE,VESPERTINA,DIARIO(REGULAR),JUTIAPA
22-01-0634-46,,JUTIAPA,JUTIAPA,INSTITUTO DE BACHILLERATO POR MADUREZ JUTIAPA(FIN DE SEMANA),,,,,DIVERSIFICADO,PRIVADO,URBANA,CERRADA TEMPORALMENTE,MONOLINGÜE,DOBLE,FIN DE SEMANA,JUTIAPA
22-01-0664-46,22-003,JUTIAPA,JUTIAPA,ESCUELA EN CIENCIAS DE LA COMUNICACIÓN ECCO,KM. 116.5,78440228,SANDRA NINETH BONILLA ARCHILA,RODABEL RÍOS CASTILLO,DIVERSIFICADO,PRIVADO,URBANA,ABIERTA,MONOLINGÜE,DOBLE,FIN DE SEMANA,JUTIAPA
22-01-1515-46,,JUTIAPA,JUTIAPA,INSTITUTO PARTICULAR MIXTO DE EDUCACIÓN DIVERSIFICADA SUPERACIÓN,,78442133,,,DIVERSIFICADO,PRIVADO,URBANA,CERRADA TEMPORALMENTE,MONOLINGÜE,MATUTINA,SABATINO,JUTIAPA
22-01-1608-46,22-005,JUTIAPA,JUTIAPA,INSTITUTO PARTICULAR MIXTO SUPERACIÓN,5A. AV. 7-35 ZONA 1,78441530,EDGAR ARNULFO GONZALEZ GUDIEL,,DIVERSIFICADO,PRIVADO,URBANA,ABIERTA,MONOLINGÜE,DOBLE,FIN DE SEMANA,JUTIAPA
22-01-1611-46,22-001,JUTIAPA,JUTIAPA,"INSTITUTO TECNICO PARTICULAR DE DIVERSIFICADO, INTECPADI",5A. CALLE 5-43 ZONA 1,78442296,CECILIA ISABEL ALDECOA CASASOLA DE CASTRO,,DIVERSIFICADO,PRIVADO,URBANA,ABIERTA,MONOLINGÜE,DOBLE,FIN DE SEMANA,JUTIAPA
22-01-1997-46,25-000,JUTIAPA,JUTIAPA,INSTITUTO GUATEMALTECO DE EDUCACIÓN RADIOFONICA (IGER),,,SONIA HAYDEE REYES MONTERROSO,,DIVERSIFICADO,PRIVADO,URBANA,CERRADA TEMPORALMENTE,MONOLINGÜE,MATUTINA,A DISTANCIA,JUTIAPA
22-01-2002-46,22-003,JUTIAPA,JUTIAPA,LICEO PREUNIVERSITARIO,"KILOMETRO 111 CARRETERA INTERAMERICANA, ALDEA AMAYITO",78232524,SANDRA NINETH BONILLA ARCHILA,NANCY PAOLA ZEPEDA SANTOS,DIVERSIFICADO,PRIVADO,RURAL,ABIERTA,MONOLINGÜE,MATUTINA,DIARIO(REGULAR),JUTIAPA
22-01-2071-46,22-001,JUTIAPA,JUTIAPA,ESCUELA NORMAL DE EDUCACIÓN FISICA,"8ª. CALLE ZONA 1, BARRIO LATINO",78440156,CECILIA ISABEL ALDECOA CASASOLA DE CASTRO,JAVIER SHMELIN HERNANDEZ ESTRADA,DIVERSIFICADO,OFICIAL,URBANA,ABIERTA,MONOLINGÜE,DOBLE,DIARIO(REGULAR),JUTIAPA
22-01-2444-46,22-004,JUTIAPA,JUTIAPA,COLEGIO PARTICULAR MIXTO DAVENPORT CIDETRA,ALDEA LAS TUNAS,78520297,MARA ALEIDA QUIÑONEZ Y QUIÑONEZ,,DIVERSIFICADO,PRIVADO,RURAL,CERRADA TEMPORALMENTE,MONOLINGÜE,DOBLE,FIN DE SEMANA,JUTIAPA
22-01-2493-46,22-003,JUTIAPA,JUTIAPA,COLEGIO EVANGELICO VIDA NUEVA,COMPLEJO EDUCATIVO 0-16 ZONA 3 BARRIO EL CONDOR,78441907,SANDRA NINETH BONILLA ARCHILA,ESLY OLIMPIA VEGA CANÚZ,DIVERSIFICADO,PRIVADO,URBANA,ABIERTA,MONOLINGÜE,VESPERTINA,DIARIO(REGULAR),JUTIAPA
22-01-2500-46,22-006,JUTIAPA,JUTIAPA,COLEGIO PARTICULAR MIXTO DAVENPORTCIDETRA,ALDEA LAS TUNAS,78444200,RONY ESTUARDO SANDOVAL MEDINA,,DIVERSIFICADO,PRIVADO,RURAL,CERRADA TEMPORALMENTE,MONOLINGÜE,MATUTINA,DIARIO(REGULAR),JUTIAPA
22-01-2527-46,22-001,JUTIAPA,JUTIAPA,COLEGIO INTEGRAL EVOLUCIÓN CIE,"7A. CALLE Y 8A. AVENIDA 7-49 ZONA 3, BARRIO EL CHAPARRON",57313172,CECILIA ISABEL ALDECOA CASASOLA DE CASTRO,,DIVERSIFICADO,PRIVADO,URBANA,ABIERTA,MONOLINGÜE,DOBLE,FIN DE SEMANA,JUTIAPA
22-02-0006-46,22-002,JUTIAPA,EL PROGRESO,INSTITUTO NACIÓNAL DE EDUCACIÓN DIVERSIFICADA,"1AV. 4-54, ZONA 2",,SANDRA PATRICIA LOPEZ DE CAMBARA,MARTA LUISA BONILLA GARCIA,DIVERSIFICADO,OFICIAL,URBANA,ABIERTA,MONOLINGÜE,VESPERTINA,DIARIO(REGULAR),JUTIAPA
22-02-0016-46,22-037,JUTIAPA,EL PROGRESO,LICEO BILINGÜE FRAY AMADEO RUANO NAJARRO,2A. AVENIDA 2-88 ZONA 1,78435491,REMBERTO RECINOS SARCEÑO,DUNIA ADALGIZA VASQUEZ RECINOS DE ZEPEDA,DIVERSIFICADO,PRIVADO,URBANA,ABIERTA,MONOLINGÜE,MATUTINA,DIARIO(REGULAR),JUTIAPA
22-02-0017-46,22-037,JUTIAPA,EL PROGRESO,COLEGIO PARTICULAR MIXTO LICEO PROGRESO,"CALZADA LA PAZ, BARRIO EL BOSQUE",78435751,REMBERTO RECINOS SARCEÑO,NELDA JUDITH PALMA ESTRADA,DIVERSIFICADO,PRIVADO,URBANA,ABIERTA,MONOLINGÜE,DOBLE,FIN DE SEMANA,JUTIAPA
22-02-0023-46,22-037,JUTIAPA,EL PROGRESO,CENTRO EDUCATIVO MUNICIPAL EL ROBLE,4TA.. CALLE 1-04 ZONA 4 BARRIO EL ROBLE,77249614,REMBERTO RECINOS SARCEÑO,MARTA LUISA BONILLA GARCÍA,DIVERSIFICADO,MUNICIPAL,URBANA,ABIERTA,MONOLINGÜE,VESPERTINA,DIARIO(REGULAR),JUTIAPA
22-02-1692-46,22-037,JUTIAPA,EL PROGRESO,INST. MIXTO DE DIVERSIFICADO POR COOPERATIVA DE ENSEÑANZA ANGELINA ACUÑA,"1A. CALLE 2-82, ZONA 2",78434008,REMBERTO RECINOS SARCEÑO,NELDA JUDITH PALMA ESTRADA,DIVERSIFICADO,COOPERATIVA,URBANA,ABIERTA,MONOLINGÜE,VESPERTINA,DIARIO(REGULAR),JUTIAPA
22-02-2203-46,22-009,JUTIAPA,EL PROGRESO,ESCUELA REGIONAL DE HOTELERIA Y TURISMO ECOLOGICO,0 CALLE 1-20 ZONA 3 EDIFICIO TERESA DE CHANG 3ER NIVEL,57167937,CARLOS HUMBERTO CRUZ ALAY,,DIVERSIFICADO,PRIVADO,URBANA,CERRADA TEMPORALMENTE,MONOLINGÜE,MATUTINA,DIARIO(REGULAR),JUTIAPA
22-02-2250-46,22-009,JUTIAPA,EL PROGRESO,COLEGIO PARTICULAR MIXTO MONTE SION,BARRIO EL BOSQUE,78435727,CARLOS HUMBERTO CRUZ ALAY,,DIVERSIFICADO,PRIVADO,URBANA,CERRADA TEMPORALMENTE,MONOLINGÜE,VESPERTINA,DIARIO(REGULAR),JUTIAPA
22-02-2460-46,22-037,JUTIAPA,EL PROGRESO,LICEO EVANGELICO HOREB,1A. AVENIDA A 6-43 ZONA 2,78435725,REMBERTO RECINOS SARCEÑO,,DIVERSIFICADO,PRIVADO,URBANA,ABIERTA,MONOLINGÜE,VESPERTINA,DIARIO(REGULAR),JUTIAPA
22-03-0011-46,22-010,JUTIAPA,SANTA CATARINA MITA,INSTITUTO NACIÓNAL DE EDUCACIÓN DIVERSIFICADA,BARRIO EL BARREAL,41723310,YELBELY ROXANA VEGA DONADO,NOE HERNANDEZ LINARES HECTOR,DIVERSIFICADO,OFICIAL,URBANA,ABIERTA,MONOLINGÜE,VESPERTINA,DIARIO(REGULAR),JUTIAPA
22-03-0026-46,22-010,JUTIAPA,SANTA CATARINA MITA,INSTITUTO TECNICO INDUSTRIAL HENRY FORD,BARRIO EL BARREAL,78883379,YELBELY ROXANA VEGA DONADO,MAXIMILIANO PAZ ROQUE,DIVERSIFICADO,PRIVADO,URBANA,ABIERTA,MONOLINGÜE,DOBLE,FIN DE SEMANA,JUTIAPA
22-03-0028-46,22-032,JUTIAPA,SANTA CATARINA MITA,INSTITUTO PARTICULAR CATARINECO,BARRIO LA ERMITA,53673753,KEVIN DANIEL SANDOVAL SALVADOR,GLADIS ARACELI OSORIO BOLAÑOS,DIVERSIFICADO,PRIVADO,RURAL,ABIERTA,MONOLINGÜE,VESPERTINA,DIARIO(REGULAR),JUTIAPA
22-03-0032-46,22-010,JUTIAPA,SANTA CATARINA MITA,CENTRO EDUCATIVO MUNICIPAL DE DIVERSIFICADO,ALDEA HORCONES,50312945,YELBELY ROXANA VEGA DONADO,FARLEEN SAUDY RUSTRIAN MARTINEZ,DIVERSIFICADO,MUNICIPAL,RURAL,ABIERTA,MONOLINGÜE,VESPERTINA,DIARIO(REGULAR),JUTIAPA
22-03-0034-46,22-032,JUTIAPA,SANTA CATARINA MITA,COLEGIO PARTICULAR MIXTO EVANGÉLICO SHALOM,BARRIO LA JAVIA,59407309,KEVIN DANIEL SANDOVAL SALVADOR,NANSI LISETH LUCERO SANTOS DE PAZ,DIVERSIFICADO,PRIVADO,URBANA,ABIERTA,MONOLINGÜE,VESPERTINA,DIARIO(REGULAR),JUTIAPA
22-03-1943-46,22-010,JUTIAPA,SANTA CATARINA MITA,LICEO SANTA CATARINA,BARRIO EL CENTRO,78883148,YELBELY ROXANA VEGA DONADO,,DIVERSIFICADO,PRIVADO,URBANA,CERRADA TEMPORALMENTE,MONOLINGÜE,VESPERTINA,DIARIO(REGULAR),JUTIAPA
22-04-0023-46,22-011,JUTIAPA,AGUA BLANCA,INSTITUTO NACIÓNAL DE EDUCACIÓN DIVERSIFICADA,BARRIO TECUAN,46181111,DULCE KARINA AGUIRRE GUERRA,MERSY LUCIA AGUIRRE CASTAÑEDA,DIVERSIFICADO,OFICIAL,URBANA,ABIERTA,MONOLINGÜE,VESPERTINA,DIARIO(REGULAR),JUTIAPA
22-04-0030-46,22-012,JUTIAPA,AGUA BLANCA,COLEGIO PARTICULAR MIXTO AGUABLANQUENSE,BARRIO LAS CASITAS,56250674,JUAN CARLOS LEMUS ESQUIVEL,EMILIO EDIVERTO ARGUETA ESPINO,DIVERSIFICADO,PRIVADO,URBANA,ABIERTA,MONOLINGÜE,DOBLE,FIN DE SEMANA,JUTIAPA
22-04-0035-46,22-011,JUTIAPA,AGUA BLANCA,LICEO JUAN PABLO II,BARRIO EL CENTRO,42633838,DULCE KARINA AGUIRRE GUERRA,RAUL FRANCISCO GUTIERREZ ORTIZ,DIVERSIFICADO,PRIVADO,URBANA,ABIERTA,MONOLINGÜE,VESPERTINA,DIARIO(REGULAR),JUTIAPA
22-04-2085-46,22-012,JUTIAPA,AGUA BLANCA,INSTITUTO DIVERSIFICADO POR COOPERATIVA,AGUA BLANCA,49494159,JUAN CARLOS LEMUS ESQUIVEL,MIRIAM ARACELY SANDOVAL GUERRA DE BARRIENTOS,DIVERSIFICADO,COOPERATIVA,URBANA,ABIERTA,MONOLINGÜE,VESPERTINA,DIARIO(REGULAR),JUTIAPA
22-05-0024-46,22-016,JUTIAPA,ASUNCIÓN MITA,INSTITUTO NACIÓNAL DE EDUCACIÓN DIVERSIFICADA,BARRIO CENTRAL,56947315,JOSE ANIBAL RUANO Y RUANO,,DIVERSIFICADO,OFICIAL,URBANA,ABIERTA,MONOLINGÜE,MATUTINA,DIARIO(REGULAR),JUTIAPA
22-05-0044-46,22-002,JUTIAPA,ASUNCIÓN MITA,COLEGIO INTEGRAL SAGRADA FAMILIA,"2 CALLE Y 6A. AV. ZON 2, BARRIO CENTRAL",78460481,SANDRA PATRICIA LOPEZ DE CAMBARA,LIDIA ALVAREZ MAZARIEGOS,DIVERSIFICADO,PRIVADO,URBANA,ABIERTA,MONOLINGÜE,VESPERTINA,DIARIO(REGULAR),JUTIAPA
22-05-0053-46,22-016,JUTIAPA,ASUNCIÓN MITA,COLEGIO PARTICULAR MIXTO INTEGRAL JOSHUA,"CASA NO. 27, BARRIO LA FEDERAL",,JOSE ANIBAL RUANO Y RUANO,GAUDY YADIRA ISABEL IXCHOP AMBROCIO,DIVERSIFICADO,PRIVADO,URBANA,ABIERTA,MONOLINGÜE,VESPERTINA,DIARIO(REGULAR),JUTIAPA
22-05-0056-46,22-009,JUTIAPA,ASUNCIÓN MITA,INSTITUTO PARTICULAR MIXTO MARÍA CHINCHILLA,BARRIO LA FEDERAL,78457668,CARLOS HUMBERTO CRUZ ALAY,SILVIA ERNESTINA MARTINEZ NAVAS DE TOBAR,DIVERSIFICADO,PRIVADO,URBANA,ABIERTA,MONOLINGÜE,DOBLE,FIN DE SEMANA,JUTIAPA
22-05-0059-46,22-017,JUTIAPA,ASUNCIÓN MITA,INSTITUTO TECNICO INDUSTRIAL HENRY FORD,BARRIO LA PAZ,78460721,SANDRA PATRICIA LOPEZ DE CAMBARA,NESTOR GONZALO RODRÍGUEZ COLINDRES,DIVERSIFICADO,PRIVADO,URBANA,ABIERTA,MONOLINGÜE,DOBLE,FIN DE SEMANA,JUTIAPA
22-05-0062-46,22-009,JUTIAPA,ASUNCIÓN MITA,ESCUELA TECNICA VOCACIÓNAL,KM. 147.5 CARRETERA INTERAMERICANA,78459883,CARLOS HUMBERTO CRUZ ALAY,HELEN ROXANA PALMA CENTES,DIVERSIFICADO,PRIVADO,URBANA,ABIERTA,MONOLINGÜE,DOBLE,DIARIO(REGULAR),JUTIAPA
22-05-0063-46,22-002,JUTIAPA,ASUNCIÓN MITA,LICEO TIUCAL,ALDEA TIUCAL,58248115,SANDRA PATRICIA LOPEZ DE CAMBARA,HEIDI CAROLINA OROZCO ORELLANA,DIVERSIFICADO,PRIVADO,RURAL,ABIERTA,MONOLINGÜE,MATUTINA,DIARIO(REGULAR),JUTIAPA
22-05-0065-46,22-009,JUTIAPA,ASUNCIÓN MITA,ESCUELA TÉNICA VOCACIÓNAL,KM. 147 147.50 CARRETERA INTERAMERICANA,78459883,CARLOS HUMBERTO CRUZ ALAY,HELEN ROXANA PALMA CENTES,DIVERSIFICADO,PRIVADO,URBANA,ABIERTA,MONOLINGÜE,MATUTINA,DIARIO(REGULAR),JUTIAPA
22-05-1437-46,22-002,JUTIAPA,ASUNCIÓN MITA,ESCUELA DE CIENCIAS COMERCIALES POR COOPERATIVA,ALDEA TIUCAL,78744300,SANDRA PATRICIA LOPEZ DE CAMBARA,MIRIAM LETICIA BOJORQUEZ LEMUS,DIVERSIFICADO,COOPERATIVA,RURAL,ABIERTA,MONOLINGÜE,MATUTINA,DIARIO(REGULAR),JUTIAPA
22-05-1610-46,22-009,JUTIAPA,ASUNCIÓN MITA,INSTITUTO PARTICULAR MIXTO NUESTRA SEÑORA DE LA ASUNCIÓN,BARRIO LA PAZ,78459147,CARLOS HUMBERTO CRUZ ALAY,JULIA ALICIA GARCIA RAMIREZ DE PALMA,DIVERSIFICADO,PRIVADO,URBANA,ABIERTA,MONOLINGÜE,MATUTINA,DIARIO(REGULAR),JUTIAPA
22-05-2080-46,,JUTIAPA,ASUNCIÓN MITA,COLEGIO PARTICULAR MIXTO EL CARMEN,BARRIO CENTRAL,78457023,,,DIVERSIFICADO,PRIVADO,URBANA,CERRADA TEMPORALMENTE,MONOLINGÜE,VESPERTINA,DIARIO(REGULAR),JUTIAPA
22-05-2212-46,22-009,JUTIAPA,ASUNCIÓN MITA,CENTRO EDUCATIVO DE INFORMATICA,BARRIO LA DEMOCRACIA,58538798,CARLOS HUMBERTO CRUZ ALAY,,DIVERSIFICADO,PRIVADO,URBANA,ABIERTA,MONOLINGÜE,DOBLE,FIN DE SEMANA,JUTIAPA
22-05-2214-46,22-009,JUTIAPA,ASUNCIÓN MITA,CENTRO EDUCATIVO DE INFORMATICA (POR MADUREZ),BARRIO LA DEMOCRACIA,58538798,CARLOS HUMBERTO CRUZ ALAY,ASTRID ROCIO SALAZAR GARCÍA DE TOBAR,DIVERSIFICADO,PRIVADO,URBANA,ABIERTA,MONOLINGÜE,DOBLE,FIN DE SEMANA,JUTIAPA
22-05-2265-46,22-014,JUTIAPA,ASUNCIÓN MITA,LICEO MITECO,BARRIO LA LIBERTAD,,MARCO TULIO CASTILLO MELGAR,,DIVERSIFICADO,PRIVADO,URBANA,ABIERTA,MONOLINGÜE,VESPERTINA,DIARIO(REGULAR),JUTIAPA
22-06-0005-46,22-034,JUTIAPA,YUPILTEPEQUE,INSTITUTO NACIÓNAL DE EDUCACIÓN DIVERSIFICADA,CABECERA MUNICIPAL,42802683,RIQUELMI SALAZAR VASQUEZ,LIMBER ALBERTO GONZÁLEZ ROBLES,DIVERSIFICADO,OFICIAL,URBANA,ABIERTA,MONOLINGÜE,MATUTINA,DIARIO(REGULAR),JUTIAPA
22-06-0011-46,22-034,JUTIAPA,YUPILTEPEQUE,COLEGIO PARTICULAR MIXTO BRISAS DEL CHINGO,ALDEA ESTANZUELA,30602683,RIQUELMI SALAZAR VASQUEZ,ESTRELLA SOLEDAD CORADO GARCIA,DIVERSIFICADO,PRIVADO,URBANA,ABIERTA,MONOLINGÜE,DOBLE,FIN DE SEMANA,JUTIAPA
22-06-0015-46,22-034,JUTIAPA,YUPILTEPEQUE,INSTITUTO DIVERSIFICADO MUNICIPAL,ALDEA EL AMATILLO,31557911,RIQUELMI SALAZAR VASQUEZ,LUDVIN OSLENDA ASENCIO MONTERROSO,DIVERSIFICADO,MUNICIPAL,RURAL,ABIERTA,MONOLINGÜE,VESPERTINA,DIARIO(REGULAR),JUTIAPA
22-06-0016-46,22-034,JUTIAPA,YUPILTEPEQUE,INSTITUTO PARTICULAR MIXTO EL JÍCARO,ALDEA EL JÍCARO,57407418,RIQUELMI SALAZAR VASQUEZ,YOSSELINE ESKARLETT MUÑOZ ZUÑIGA,DIVERSIFICADO,PRIVADO,RURAL,ABIERTA,MONOLINGÜE,DOBLE,FIN DE SEMANA,JUTIAPA
22-06-0018-46,22-034,JUTIAPA,YUPILTEPEQUE,LICEO YUPANO,BARRIO EL INSTITUTO,78820861,RIQUELMI SALAZAR VASQUEZ,INMER WILFREDO VELASQUEZ DOMINGUEZ,DIVERSIFICADO,PRIVADO,URBANA,ABIERTA,MONOLINGÜE,VESPERTINA,DIARIO(REGULAR),JUTIAPA
22-06-0025-46,22-032,JUTIAPA,YUPILTEPEQUE,INSTITUTO DE EDUCACIÓN DIVERSIFICADA POR COOPERATIVA,ALDEA EL AMATILLO,31557911,KEVIN DANIEL SANDOVAL SALVADOR,LUDVIN OSLENDA ASENCIO MONTERROSO,DIVERSIFICADO,COOPERATIVA,RURAL,ABIERTA,MONOLINGÜE,VESPERTINA,DIARIO(REGULAR),JUTIAPA
22-06-2333-46,22-034,JUTIAPA,YUPILTEPEQUE,COLEGIO PARTICULAR MIXTO DE DIVERSIFICADO EL PORVENIR,CABECERA MUNICIPAL,41514427,RIQUELMI SALAZAR VASQUEZ,,DIVERSIFICADO,PRIVADO,URBANA,ABIERTA,MONOLINGÜE,VESPERTINA,DIARIO(REGULAR),JUTIAPA
22-07-0002-46,22-020,JUTIAPA,ATESCATEMPA,COLEGIO PARTICULAR MIXTO DE DIVERSIFICADO LICEO SAN CRISTOBAL,SAN CRISTOBAL FRONTERA,78845586,MARCELINA MARTINEZ GUEVARA DE HERNANDEZ,MARLON ESTUARDO PINTO PIMENTEI,DIVERSIFICADO,PRIVADO,RURAL,ABIERTA,MONOLINGÜE,VESPERTINA,DIARIO(REGULAR),JUTIAPA
22-07-0008-46,22-020,JUTIAPA,ATESCATEMPA,INSTITUTO NACIÓNAL DE EDUCACIÓN DIVERSIFICADA,BARRIO LA FEDERAL,55731706,MARCELINA MARTINEZ GUEVARA DE HERNANDEZ,,DIVERSIFICADO,OFICIAL,URBANA,ABIERTA,MONOLINGÜE,VESPERTINA,DIARIO(REGULAR),JUTIAPA
22-07-0021-46,22-020,JUTIAPA,ATESCATEMPA,ESCUELA DE CIENCIAS EMPRESARIALES ECCE,BARRIO EL CENTRO,53592568,MARCELINA MARTINEZ GUEVARA DE HERNANDEZ,MARCOS VINICIO GARCIA HERRERA,DIVERSIFICADO,PRIVADO,URBANA,ABIERTA,MONOLINGÜE,VESPERTINA,DIARIO(REGULAR),JUTIAPA
22-07-0023-46,22-020,JUTIAPA,ATESCATEMPA,COLEGIO PRIVADO SAN FRANCISCO DE ASÍS,ZONA 0 BARRIO CENTRO,30394472,MARCELINA MARTINEZ GUEVARA DE HERNANDEZ,ANA RUTH VALLE SALAZAR,DIVERSIFICADO,PRIVADO,URBANA,ABIERTA,MONOLINGÜE,DOBLE,FIN DE SEMANA,JUTIAPA
22-07-0027-46,22-020,JUTIAPA,ATESCATEMPA,COLEGIO EVANGÉLICO PARTICULAR MIXTO CENTROAMÉRICANO,BARRIO LA CEIBA,59136475,MARCELINA MARTINEZ GUEVARA DE HERNANDEZ,GLENDA MARLENI BEZA PALACIOS DE SAMAYOA,DIVERSIFICADO,PRIVADO,URBANA,ABIERTA,MONOLINGÜE,MATUTINA,DIARIO(REGULAR),JUTIAPA
22-07-0330-46,22-017,JUTIAPA,ATESCATEMPA,INSTITUTO PARTICULAR MIXTO DE CIENCIAS COMERCIALES,,,SANDRA PATRICIA LOPEZ DE CAMBARA,,DIVERSIFICADO,PRIVADO,URBANA,ABIERTA,MONOLINGÜE,VESPERTINA,DIARIO(REGULAR),JUTIAPA
22-07-2198-46,22-020,JUTIAPA,ATESCATEMPA,LICEO ATESCATEMPA,"2A. AVENIDA 3-19, ZONA 1",,MARCELINA MARTINEZ GUEVARA DE HERNANDEZ,,DIVERSIFICADO,PRIVADO,URBANA,ABIERTA,MONOLINGÜE,MATUTINA,DIARIO(REGULAR),JUTIAPA
22-07-2324-46,22-020,JUTIAPA,ATESCATEMPA,COLEGIO PARTICULAR MIXTO SAN CRISTOBAL,ALDEA SAN CRISTOBAL FRONTERA,78845584,MARCELINA MARTINEZ GUEVARA DE HERNANDEZ,HAIVIN ESTRADA Y ESTRADA,DIVERSIFICADO,PRIVADO,RURAL,ABIERTA,MONOLINGÜE,DOBLE,FIN DE SEMANA,JUTIAPA
22-07-2442-46,22-020,JUTIAPA,ATESCATEMPA,INSTITUTO MUNICIPAL DE DIVERSIFICADO,ALDEA CONTEPEQUE,42464788,MARCELINA MARTINEZ GUEVARA DE HERNANDEZ,IMMA CONSUELO HERNANDEZ ESTRADA DE MARTINEZ,DIVERSIFICADO,MUNICIPAL,RURAL,ABIERTA,MONOLINGÜE,VESPERTINA,DIARIO(REGULAR),JUTIAPA
22-08-0005-46,22-021,JUTIAPA,JEREZ,INSTITUTO NACIÓNAL DE EDUCACIÓN DIVERSIFICADA,CABECERA MUNICIPAL,51358754,JAIME ESTUARDO LUCERO MEJIA,ESTRELLA CORADO,DIVERSIFICADO,OFICIAL,URBANA,ABIERTA,MONOLINGÜE,VESPERTINA,DIARIO(REGULAR),JUTIAPA
22-08-2114-46,22-021,JUTIAPA,JEREZ,INSTITUTO MUNICIPAL DE EDUCACIÓN MEDIA,CABECERA MUNICIPAL,42616549,JAIME ESTUARDO LUCERO MEJIA,ESTRELLA SOLEDAD CORADO GARCIA,DIVERSIFICADO,MUNICIPAL,URBANA,ABIERTA,MONOLINGÜE,VESPERTINA,DIARIO(REGULAR),JUTIAPA
22-09-0007-46,22-019,JUTIAPA,EL ADELANTO,INSTITUTO MUNICIPAL DE DIVERSIFICADO PROFESOR WILLIAM FRANCISCO CORADO QUIÑONEZ,BARRIO EL CENTRO,53350110,ARTURO CARDONA CHINCHILLA,HEIDI MILENA CORADO VALENZUELA,DIVERSIFICADO,MUNICIPAL,URBANA,ABIERTA,MONOLINGÜE,VESPERTINA,DIARIO(REGULAR),JUTIAPA
22-09-0008-46,22-019,JUTIAPA,EL ADELANTO,COLEGIO INTEGRAL CIENCIA Y DESARROLLO,BARRIO ARRIBA,47160153,ARTURO CARDONA CHINCHILLA,LILIAN FLORIBEL REVOLORIO LINARES,DIVERSIFICADO,PRIVADO,URBANA,ABIERTA,MONOLINGÜE,VESPERTINA,DIARIO(REGULAR),JUTIAPA
22-10-0011-46,22-004,JUTIAPA,ZAPOTITLAN,INSTITUTO NACIÓNAL DE EDUCACIÓN DIVERSIFICADA,CABECERA MUNICIPAL,59922708,MARA ALEIDA QUIÑONEZ Y QUIÑONEZ,MIRNA NOEMI QUIÑONEZ NAJARRO,DIVERSIFICADO,OFICIAL,URBANA,ABIERTA,MONOLINGÜE,MATUTINA,DIARIO(REGULAR),JUTIAPA
22-10-0018-46,22-004,JUTIAPA,ZAPOTITLAN,INSTITUTO DE DIVERSIFICADO POR COOPERATIVA INDICOPA,ALDEA SAN ANTONIO EL PAPATURRO,42587819,MARA ALEIDA QUIÑONEZ Y QUIÑONEZ,ENA AMABILIA BARRIENTOS ASENCIO,DIVERSIFICADO,COOPERATIVA,RURAL,ABIERTA,MONOLINGÜE,VESPERTINA,DIARIO(REGULAR),JUTIAPA
22-10-0020-46,22-004,JUTIAPA,ZAPOTITLAN,INSTITUTO DIVERSIFICADO POR COOPERATIVA,CABECERA MUNICIPAL,41963518,MARA ALEIDA QUIÑONEZ Y QUIÑONEZ,JULIETA ILUCIÓN QUIÑONEZ Y QUIÑONEZ,DIVERSIFICADO,COOPERATIVA,URBANA,ABIERTA,MONOLINGÜE,VESPERTINA,DIARIO(REGULAR),JUTIAPA
